{
  "$schema": "https://json-schema.org/draft/2020-12/schema",
  "$id": "https://confenge.com.br/schemas/acceptance-binding.v1.schema.json",
  "title": "confenge.acceptance_binding.v1",
  "type": "object",
  "additionalProperties": false,
  "required": [
    "schema_version", "acceptance_id", "correlation_id", "proposal_id",
    "proposal_version", "accepted_snapshot_hash", "offer_id", "offer_version",
    "deliverable_id", "deliverable_version", "terms_version", "amount_cents",
    "accepted_at", "synthetic", "immutable", "record_hash", "evidence_refs"
  ],
  "properties": {
    "schema_version": {"const": "confenge.acceptance_binding.v1"},
    "acceptance_id": {"type": "string", "minLength": 1},
    "correlation_id": {"type": "string", "minLength": 1},
    "proposal_id": {"type": "string", "minLength": 1},
    "proposal_version": {"type": "integer", "minimum": 1},
    "accepted_snapshot_hash": {"type": "string", "pattern": "^sha256:[a-f0-9]{64}$"},
    "offer_id": {"type": "string", "minLength": 1},
    "offer_version": {"type": "string", "minLength": 1},
    "deliverable_id": {"type": "string", "minLength": 1},
    "deliverable_version": {"type": "string", "minLength": 1},
    "terms_version": {"type": "string", "minLength": 1},
    "amount_cents": {"type": "integer", "minimum": 0},
    "accepted_at": {"type": "string", "format": "date-time"},
    "synthetic": {"const": true},
    "immutable": {"const": true},
    "record_hash": {"type": "string", "pattern": "^sha256:[a-f0-9]{64}$"},
    "evidence_refs": {
      "type": "array", "minItems": 1, "uniqueItems": true,
      "items": {"type": "string", "minLength": 1}
    }
  }
}
